{
  "$schema": "https://json-schema.org/draft/2020-12/schema",
  "type": "object",
  "required": [
    "cli",
    "mode"
  ],
  "$defs": {
    "refreshPolicy": {
      "type": "object",
      "properties": {
        "maxAgeSeconds": {
          "type": "integer",
          "minimum": 0
        },
        "manualOnly": {
          "type": "boolean"
        }
      },
      "additionalProperties": false
    },
    "secretRef": {
      "type": "object",
      "required": [
        "type"
      ],
      "properties": {
        "type": {
          "enum": [
            "literal",
            "env",
            "file",
            "osKeychain",
            "exec"
          ]
        },
        "value": {
          "type": "string",
          "minLength": 1
        },
        "command": {
          "type": "array",
          "items": {
            "type": "string"
          }
        }
      },
      "additionalProperties": false
    },
    "oauthSecret": {
      "type": "object",
      "required": [
        "type",
        "mode"
      ],
      "properties": {
        "type": {
          "const": "oauth2"
        },
        "mode": {
          "enum": [
            "authorizationCode",
            "clientCredentials"
          ]
        },
        "issuer": {
          "type": "string",
          "minLength": 1
        },
        "authorizationURL": {
          "type": "string",
          "minLength": 1
        },
        "tokenURL": {
          "type": "string",
          "minLength": 1
        },
        "clientId": {
          "$ref": "#/$defs/secretRef"
        },
        "clientSecret": {
          "$ref": "#/$defs/secretRef"
        },
        "scopes": {
          "type": "array",
          "items": {
            "type": "string"
          }
        },
        "audience": {
          "type": "string",
          "minLength": 1
        },
        "interactive": {
          "type": "boolean"
        },
        "callbackPort": {
          "type": "integer",
          "minimum": 1
        },
        "redirectURI": {
          "type": "string",
          "minLength": 1
        },
        "tokenStorage": {
          "enum": [
            "instance",
            "memory"
          ]
        }
      },
      "additionalProperties": false
    },
    "oauthConfig": {
      "type": "object",
      "required": [
        "mode"
      ],
      "properties": {
        "mode": {
          "enum": [
            "authorizationCode",
            "clientCredentials",
            "openIdConnect"
          ]
        },
        "issuer": {
          "type": "string",
          "minLength": 1
        },
        "authorizationURL": {
          "type": "string",
          "minLength": 1
        },
        "tokenURL": {
          "type": "string",
          "minLength": 1
        },
        "clientId": {
          "$ref": "#/$defs/secretRef"
        },
        "clientSecret": {
          "$ref": "#/$defs/secretRef"
        },
        "scopes": {
          "type": "array",
          "items": {
            "type": "string"
          }
        },
        "audience": {
          "type": "string",
          "minLength": 1
        },
        "interactive": {
          "type": "boolean"
        },
        "callbackPort": {
          "type": "integer",
          "minimum": 1
        },
        "redirectURI": {
          "type": "string",
          "minLength": 1
        },
        "tokenStorage": {
          "enum": [
            "instance",
            "memory"
          ]
        }
      },
      "additionalProperties": false
    },
    "localRuntime": {
      "type": "object",
      "properties": {
        "sessionScope": {
          "enum": [
            "terminal",
            "agent",
            "shared-group"
          ]
        },
        "heartbeatSeconds": {
          "type": "integer",
          "minimum": 1
        },
        "missedHeartbeatLimit": {
          "type": "integer",
          "minimum": 1
        },
        "shutdown": {
          "enum": [
            "when-owner-exits",
            "manual"
          ]
        },
        "share": {
          "enum": [
            "exclusive",
            "group"
          ]
        },
        "shareKey": {
          "type": "string",
          "minLength": 1
        }
      },
      "additionalProperties": false
    },
    "browserLogin": {
      "type": "object",
      "properties": {
        "callbackPort": {
          "type": "integer",
          "minimum": 1
        }
      },
      "additionalProperties": false
    },
    "runtimeServerAuth": {
      "type": "object",
      "properties": {
        "validationProfile": {
          "enum": [
            "oidc_jwks",
            "oauth2_introspection"
          ]
        },
        "mode": {
          "enum": [
            "oauth2Introspection"
          ]
        },
        "issuer": {
          "type": "string",
          "minLength": 1
        },
        "jwksURL": {
          "type": "string",
          "minLength": 1
        },
        "audience": {
          "type": "string",
          "minLength": 1
        },
        "introspectionURL": {
          "type": "string",
          "minLength": 1
        },
        "authorizationURL": {
          "type": "string",
          "minLength": 1
        },
        "tokenURL": {
          "type": "string",
          "minLength": 1
        },
        "browserClientId": {
          "type": "string",
          "minLength": 1
        },
        "clientId": {
          "$ref": "#/$defs/secretRef"
        },
        "clientSecret": {
          "$ref": "#/$defs/secretRef"
        }
      },
      "additionalProperties": false,
      "allOf": [
        {
          "if": {
            "properties": {
              "validationProfile": {
                "const": "oidc_jwks"
              }
            },
            "required": [
              "validationProfile"
            ]
          },
          "then": {
            "required": [
              "issuer",
              "jwksURL"
            ]
          }
        },
        {
          "if": {
            "properties": {
              "validationProfile": {
                "const": "oauth2_introspection"
              }
            },
            "required": [
              "validationProfile"
            ]
          },
          "then": {
            "required": [
              "audience",
              "introspectionURL"
            ]
          }
        },
        {
          "if": {
            "properties": {
              "mode": {
                "const": "oauth2Introspection"
              }
            },
            "required": [
              "mode"
            ]
          },
          "then": {
            "required": [
              "audience",
              "introspectionURL"
            ]
          }
        }
      ]
    },
    "runtimeServer": {
      "type": "object",
      "properties": {
        "auth": {
          "$ref": "#/$defs/runtimeServerAuth"
        }
      },
      "additionalProperties": false
    },
    "remoteOAuthClient": {
      "type": "object",
      "properties": {
        "tokenURL": {
          "type": "string",
          "minLength": 1
        },
        "clientId": {
          "$ref": "#/$defs/secretRef"
        },
        "clientSecret": {
          "$ref": "#/$defs/secretRef"
        }
      },
      "additionalProperties": false
    },
    "remoteOAuth": {
      "type": "object",
      "properties": {
        "mode": {
          "enum": [
            "providedToken",
            "oauthClient",
            "browserLogin"
          ]
        },
        "audience": {
          "type": "string",
          "minLength": 1
        },
        "scopes": {
          "type": "array",
          "items": {
            "type": "string"
          }
        },
        "tokenRef": {
          "type": "string",
          "minLength": 1
        },
        "client": {
          "$ref": "#/$defs/remoteOAuthClient"
        },
        "browserLogin": {
          "$ref": "#/$defs/browserLogin"
        }
      },
      "additionalProperties": false
    },
    "runtime": {
      "type": "object",
      "properties": {
        "mode": {
          "enum": [
            "auto",
            "embedded",
            "local",
            "remote"
          ]
        },
        "local": {
          "$ref": "#/$defs/localRuntime"
        },
        "remote": {
          "type": "object",
          "properties": {
            "url": {
              "type": "string",
              "minLength": 1
            },
            "oauth": {
              "$ref": "#/$defs/remoteOAuth"
            }
          },
          "additionalProperties": false
        },
        "server": {
          "$ref": "#/$defs/runtimeServer"
        }
      },
      "additionalProperties": false
    },
    "mcpTransport": {
      "type": "object",
      "required": [
        "type"
      ],
      "properties": {
        "type": {
          "enum": [
            "stdio",
            "sse",
            "streamable-http"
          ]
        },
        "command": {
          "type": "string",
          "minLength": 1
        },
        "args": {
          "type": "array",
          "items": {
            "type": "string"
          }
        },
        "env": {
          "type": "object",
          "additionalProperties": {
            "type": "string"
          }
        },
        "url": {
          "type": "string",
          "minLength": 1
        },
        "headers": {
          "type": "object",
          "additionalProperties": {
            "type": "string"
          }
        },
        "headerSecrets": {
          "type": "object",
          "additionalProperties": {
            "type": "string"
          }
        }
      },
      "additionalProperties": false
    },
    "source": {
      "type": "object",
      "required": [
        "type"
      ],
      "properties": {
        "type": {
          "enum": [
            "apiCatalog",
            "serviceRoot",
            "openapi",
            "mcp"
          ]
        },
        "uri": {
          "type": "string",
          "minLength": 1
        },
        "enabled": {
          "type": "boolean"
        },
        "refresh": {
          "$ref": "#/$defs/refreshPolicy"
        },
        "transport": {
          "$ref": "#/$defs/mcpTransport"
        },
        "disabledTools": {
          "type": "array",
          "items": {
            "type": "string"
          }
        },
        "oauth": {
          "$ref": "#/$defs/oauthConfig"
        }
      },
      "allOf": [
        {
          "if": {
            "required": [
              "type"
            ],
            "properties": {
              "type": {
                "const": "mcp"
              }
            }
          },
          "then": {
            "required": [
              "transport"
            ],
            "properties": {
              "uri": false
            }
          }
        },
        {
          "if": {
            "required": [
              "type"
            ],
            "properties": {
              "type": {
                "enum": [
                  "apiCatalog",
                  "serviceRoot",
                  "openapi"
                ]
              }
            }
          },
          "then": {
            "required": [
              "uri"
            ],
            "properties": {
              "transport": false,
              "disabledTools": false,
              "oauth": false
            }
          }
        }
      ],
      "additionalProperties": false
    },
    "service": {
      "type": "object",
      "required": [
        "source"
      ],
      "properties": {
        "source": {
          "type": "string",
          "minLength": 1
        },
        "alias": {
          "type": "string",
          "minLength": 1
        },
        "overlays": {
          "type": "array",
          "items": {
            "type": "string"
          }
        },
        "skills": {
          "type": "array",
          "items": {
            "type": "string"
          }
        },
        "workflows": {
          "type": "array",
          "items": {
            "type": "string"
          }
        }
      },
      "additionalProperties": false
    },
    "mcpServer": {
      "type": "object",
      "required": [
        "type"
      ],
      "properties": {
        "type": {
          "enum": [
            "stdio",
            "sse",
            "streamable-http"
          ]
        },
        "command": {
          "type": "string",
          "minLength": 1
        },
        "args": {
          "type": "array",
          "items": {
            "type": "string"
          }
        },
        "env": {
          "type": "object",
          "additionalProperties": {
            "type": "string"
          }
        },
        "url": {
          "type": "string",
          "minLength": 1
        },
        "headers": {
          "type": "object",
          "additionalProperties": {
            "type": "string"
          }
        },
        "headerSecrets": {
          "type": "object",
          "additionalProperties": {
            "type": "string"
          }
        },
        "disabledTools": {
          "type": "array",
          "items": {
            "type": "string"
          }
        },
        "oauth": {
          "$ref": "#/$defs/oauthConfig"
        }
      },
      "additionalProperties": false
    }
  },
  "properties": {
    "cli": {
      "type": "string",
      "minLength": 1
    },
    "mode": {
      "type": "object",
      "required": [
        "default"
      ],
      "properties": {
        "default": {
          "enum": [
            "discover",
            "curated"
          ]
        }
      },
      "additionalProperties": false
    },
    "sources": {
      "type": "object",
      "minProperties": 1,
      "additionalProperties": {
        "$ref": "#/$defs/source"
      }
    },
    "mcpServers": {
      "type": "object",
      "additionalProperties": {
        "$ref": "#/$defs/mcpServer"
      }
    },
    "runtime": {
      "$ref": "#/$defs/runtime"
    },
    "services": {
      "type": "object",
      "additionalProperties": {
        "$ref": "#/$defs/service"
      }
    },
    "curation": {
      "type": "object",
      "properties": {
        "toolSets": {
          "type": "object",
          "additionalProperties": {
            "type": "object",
            "properties": {
              "allow": {
                "type": "array",
                "items": {
                  "type": "string"
                }
              },
              "deny": {
                "type": "array",
                "items": {
                  "type": "string"
                }
              }
            },
            "additionalProperties": false
          }
        }
      },
      "additionalProperties": false
    },
    "agents": {
      "type": "object",
      "properties": {
        "defaultProfile": {
          "type": "string",
          "minLength": 1
        },
        "profiles": {
          "type": "object",
          "additionalProperties": {
            "type": "object",
            "properties": {
              "mode": {
                "enum": [
                  "discover",
                  "curated"
                ]
              },
              "toolSet": {
                "type": "string",
                "minLength": 1
              }
            },
            "additionalProperties": false
          }
        }
      },
      "additionalProperties": false
    },
    "policy": {
      "type": "object",
      "properties": {
        "deny": {
          "type": "array",
          "items": {
            "type": "string"
          }
        },
        "approvalRequired": {
          "type": "array",
          "items": {
            "type": "string"
          }
        },
        "allowExecSecrets": {
          "type": "boolean"
        }
      },
      "additionalProperties": false
    },
    "secrets": {
      "type": "object",
      "additionalProperties": {
        "anyOf": [
          {
            "$ref": "#/$defs/secretRef"
          },
          {
            "$ref": "#/$defs/oauthSecret"
          }
        ]
      }
    }
  },
  "anyOf": [
    {
      "required": [
        "sources"
      ]
    },
    {
      "required": [
        "mcpServers"
      ]
    }
  ],
  "additionalProperties": false
}
